[
  {
    "alert_id": 5001,
    "severity": "high",
    "rule": {"name": "multi_accounting", "version": "2.3.1"},
    "entities": [
      {"entity_type": "player", "entity_id": "99102"},
      {"entity_type": "device", "entity_id": "ios-abc-001"}
    ],
    "triggered_at": "2026-05-21T11:09:30Z"
  }
]
